750565402799996928,cornell sex bbw free porn galleries https t co qmgaw0p2n9 https t co usnh5f3wsp,1
750564087831101441,rt molinkimberly swarmprincess omg same cornell,1
750558805243596800,swarmprincess omg same cornell,1
750528509064470528,the waiting game cornell softdevguys andgirls https t co vpejdhaxag,1
750512341456912385,loew cornell 1021254 woodsies craft stic https t co jjmx3wf109 loew cornell 1021254 woods https t co lf34nak3cu,1
750510200520454144,hillaryclinton madam secretary i 've been ur fan since freshmen ur at cornell and i still support u but how could u have been so careless,2
